{
  "format": 1,
  "oscal-release": "1.2.3",
  "schema": {
    "file": "oscal_complete_schema.json",
    "sha256": "384324105c7a817af0f65b120a963146caa0e0d55d969cf0daf60e063b87a206"
  },
  "types": [
    {
      "kind": "object",
      "name": "Action",
      "sites": [
        "#/definitions/oscal-complete-oscal-metadata:action"
      ]
    },
    {
      "kind": "object",
      "name": "Activity",
      "sites": [
        "#/definitions/oscal-complete-oscal-assessment-common:activity"
      ]
    },
    {
      "kind": "object",
      "name": "ActivityStep",
      "sites": [
        "#/definitions/oscal-complete-oscal-assessment-common:activity/properties/steps/items"
      ]
    },
    {
      "kind": "object",
      "name": "Address",
      "sites": [
        "#/definitions/oscal-complete-oscal-metadata:address"
      ]
    },
    {
      "closed": false,
      "kind": "enum",
      "name": "AddressType",
      "sites": [
        "#/definitions/oscal-complete-oscal-metadata:address/properties/type/anyOf/1"
      ]
    },
    {
      "kind": "object",
      "name": "AssessmentAssets",
      "sites": [
        "#/definitions/oscal-complete-oscal-assessment-common:assessment-assets"
      ]
    },
    {
      "kind": "object",
      "name": "AssessmentCommonSelectControlById",
      "sites": [
        "#/definitions/oscal-complete-oscal-assessment-common:select-control-by-id"
      ]
    },
    {
      "kind": "object",
      "name": "AssessmentMethod",
      "sites": [
        "#/definitions/oscal-complete-oscal-assessment-common:assessment-method"
      ]
    },
    {
      "kind": "object",
      "name": "AssessmentPart",
      "sites": [
        "#/definitions/oscal-complete-oscal-assessment-common:assessment-part"
      ]
    },
    {
      "closed": false,
      "kind": "enum",
      "name": "AssessmentPartName",
      "sites": [
        "#/definitions/oscal-complete-oscal-assessment-common:assessment-part/properties/name/anyOf/1"
      ]
    },
    {
      "kind": "object",
      "name": "AssessmentPlan",
      "sites": [
        "#/definitions/oscal-complete-oscal-ap:assessment-plan"
      ]
    },
    {
      "body-field": "assessment-plan",
      "kind": "document",
      "name": "AssessmentPlanDocument",
      "sites": [
        "#/oneOf/5"
      ]
    },
    {
      "kind": "object",
      "name": "AssessmentPlanLocalDefinitions",
      "sites": [
        "#/definitions/oscal-complete-oscal-ap:assessment-plan/properties/local-definitions"
      ]
    },
    {
      "kind": "object",
      "name": "AssessmentPlanTermsAndConditions",
      "sites": [
        "#/definitions/oscal-complete-oscal-ap:assessment-plan/properties/terms-and-conditions"
      ]
    },
    {
      "kind": "object",
      "name": "AssessmentPlatform",
      "sites": [
        "#/definitions/oscal-complete-oscal-assessment-common:assessment-assets/properties/assessment-platforms/items"
      ]
    },
    {
      "kind": "object",
      "name": "AssessmentPlatformUsesComponent",
      "sites": [
        "#/definitions/oscal-complete-oscal-assessment-common:assessment-assets/properties/assessment-platforms/items/properties/uses-components/items"
      ]
    },
    {
      "kind": "object",
      "name": "AssessmentResults",
      "sites": [
        "#/definitions/oscal-complete-oscal-ar:assessment-results"
      ]
    },
    {
      "body-field": "assessment-results",
      "kind": "document",
      "name": "AssessmentResultsDocument",
      "sites": [
        "#/oneOf/6"
      ]
    },
    {
      "kind": "object",
      "name": "AssessmentResultsLocalDefinitions",
      "sites": [
        "#/definitions/oscal-complete-oscal-ar:assessment-results/properties/local-definitions"
      ]
    },
    {
      "kind": "union",
      "name": "AssessmentSubject",
      "sites": [
        "#/definitions/oscal-complete-oscal-assessment-common:assessment-subject"
      ],
      "variants": [
        {
          "property": "include-all",
          "type": "AssessmentSubjectWithIncludeAll"
        },
        {
          "property": "include-subjects",
          "type": "AssessmentSubjectWithIncludeSubjects"
        }
      ]
    },
    {
      "kind": "object",
      "name": "AssessmentSubjectPlaceholder",
      "sites": [
        "#/definitions/oscal-complete-oscal-assessment-common:assessment-subject-placeholder"
      ]
    },
    {
      "kind": "object",
      "name": "AssessmentSubjectPlaceholderSource",
      "sites": [
        "#/definitions/oscal-complete-oscal-assessment-common:assessment-subject-placeholder/properties/sources/items"
      ]
    },
    {
      "closed": false,
      "kind": "enum",
      "name": "AssessmentSubjectType",
      "sites": [
        "#/definitions/oscal-complete-oscal-assessment-common:assessment-subject/anyOf/0/properties/type/anyOf/1",
        "#/definitions/oscal-complete-oscal-assessment-common:assessment-subject/anyOf/1/properties/type/anyOf/1"
      ]
    },
    {
      "kind": "object",
      "name": "AssessmentSubjectWithIncludeAll",
      "sites": [
        "#/definitions/oscal-complete-oscal-assessment-common:assessment-subject/anyOf/0"
      ]
    },
    {
      "kind": "object",
      "name": "AssessmentSubjectWithIncludeSubjects",
      "sites": [
        "#/definitions/oscal-complete-oscal-assessment-common:assessment-subject/anyOf/1"
      ]
    },
    {
      "kind": "object",
      "name": "AssociatedRisk",
      "sites": [
        "#/definitions/oscal-complete-oscal-assessment-common:associated-risk"
      ]
    },
    {
      "kind": "object",
      "name": "AuthorizationBoundary",
      "sites": [
        "#/definitions/oscal-complete-oscal-ssp:authorization-boundary"
      ]
    },
    {
      "kind": "object",
      "name": "AuthorizedPrivilege",
      "sites": [
        "#/definitions/oscal-complete-oscal-implementation-common:authorized-privilege"
      ]
    },
    {
      "kind": "object",
      "name": "BackMatter",
      "sites": [
        "#/definitions/oscal-complete-oscal-metadata:back-matter"
      ]
    },
    {
      "kind": "object",
      "name": "BackMatterResource",
      "sites": [
        "#/definitions/oscal-complete-oscal-metadata:back-matter/properties/resources/items"
      ]
    },
    {
      "kind": "object",
      "name": "BackMatterResourceBase64",
      "sites": [
        "#/definitions/oscal-complete-oscal-metadata:back-matter/properties/resources/items/properties/base64"
      ]
    },
    {
      "kind": "object",
      "name": "BackMatterResourceCitation",
      "sites": [
        "#/definitions/oscal-complete-oscal-metadata:back-matter/properties/resources/items/properties/citation"
      ]
    },
    {
      "kind": "object",
      "name": "BackMatterResourceRlink",
      "sites": [
        "#/definitions/oscal-complete-oscal-metadata:back-matter/properties/resources/items/properties/rlinks/items"
      ]
    },
    {
      "kind": "object",
      "name": "ByComponent",
      "sites": [
        "#/definitions/oscal-complete-oscal-ssp:by-component"
      ]
    },
    {
      "kind": "object",
      "name": "ByComponentExport",
      "sites": [
        "#/definitions/oscal-complete-oscal-ssp:by-component/properties/export"
      ]
    },
    {
      "kind": "object",
      "name": "ByComponentExportProvided",
      "sites": [
        "#/definitions/oscal-complete-oscal-ssp:by-component/properties/export/properties/provided/items"
      ]
    },
    {
      "kind": "object",
      "name": "ByComponentExportResponsibility",
      "sites": [
        "#/definitions/oscal-complete-oscal-ssp:by-component/properties/export/properties/responsibilities/items"
      ]
    },
    {
      "kind": "object",
      "name": "ByComponentInherited",
      "sites": [
        "#/definitions/oscal-complete-oscal-ssp:by-component/properties/inherited/items"
      ]
    },
    {
      "kind": "object",
      "name": "ByComponentSatisfied",
      "sites": [
        "#/definitions/oscal-complete-oscal-ssp:by-component/properties/satisfied/items"
      ]
    },
    {
      "kind": "object",
      "name": "Capability",
      "sites": [
        "#/definitions/oscal-complete-oscal-component-definition:capability"
      ]
    },
    {
      "kind": "object",
      "name": "Catalog",
      "sites": [
        "#/definitions/oscal-complete-oscal-catalog:catalog"
      ]
    },
    {
      "body-field": "catalog",
      "kind": "document",
      "name": "CatalogDocument",
      "sites": [
        "#/oneOf/0"
      ]
    },
    {
      "kind": "union",
      "name": "CatalogGroup",
      "sites": [
        "#/definitions/oscal-complete-oscal-catalog:group"
      ],
      "variants": [
        {
          "property": "controls",
          "type": "CatalogGroupWithControls"
        },
        {
          "property": "groups",
          "type": "CatalogGroupWithGroups"
        }
      ]
    },
    {
      "kind": "object",
      "name": "CatalogGroupWithControls",
      "sites": [
        "#/definitions/oscal-complete-oscal-catalog:group/anyOf/1"
      ]
    },
    {
      "kind": "object",
      "name": "CatalogGroupWithGroups",
      "sites": [
        "#/definitions/oscal-complete-oscal-catalog:group/anyOf/0"
      ]
    },
    {
      "kind": "object",
      "name": "Characterization",
      "sites": [
        "#/definitions/oscal-complete-oscal-assessment-common:characterization"
      ]
    },
    {
      "kind": "object",
      "name": "CharacterizationFacet",
      "sites": [
        "#/definitions/oscal-complete-oscal-assessment-common:characterization/properties/facets/items"
      ]
    },
    {
      "closed": false,
      "kind": "enum",
      "name": "CharacterizationFacetSystem",
      "sites": [
        "#/definitions/oscal-complete-oscal-assessment-common:characterization/properties/facets/items/properties/system/anyOf/1"
      ]
    },
    {
      "kind": "object",
      "name": "ComponentDefinition",
      "sites": [